{
  "$schema": "https://json-schema.org/draft/2020-12/schema",
  "$id": "map.schema.json",
  "type": "object",
  "additionalProperties": false,
  "required": [
    "schema_version",
    "id",
    "scene_3d",
    "size_m",
    "grid_resolution_m",
    "obstacles",
    "surfaces",
    "markers",
    "actors"
  ],
  "properties": {
    "schema_version": {
      "const": 1
    },
    "id": {
      "$ref": "#/$defs/id"
    },
    "scene_3d": {
      "$ref": "#/$defs/id"
    },
    "size_m": {
      "$ref": "#/$defs/positive_vec2"
    },
    "grid_resolution_m": {
      "type": "number",
      "exclusiveMinimum": 0
    },
    "obstacles": {
      "type": "array",
      "items": {
        "$ref": "#/$defs/box"
      }
    },
    "surfaces": {
      "type": "array",
      "items": {
        "$ref": "#/$defs/surface"
      }
    },
    "terrain": {
      "type": "array",
      "items": {
        "$ref": "#/$defs/terrain"
      }
    },
    "conflict_zones": {
      "type": "array",
      "items": {
        "$ref": "#/$defs/conflict_zone"
      }
    },
    "world_objects": {
      "type": "array",
      "items": {
        "$ref": "#/$defs/world_object"
      }
    },
    "markers": {
      "type": "object",
      "minProperties": 1,
      "propertyNames": {
        "$ref": "#/$defs/id"
      },
      "additionalProperties": {
        "$ref": "#/$defs/pose"
      }
    },
    "actors": {
      "type": "array",
      "items": {
        "$ref": "#/$defs/actor"
      }
    }
  },
  "$defs": {
    "id": {
      "type": "string",
      "pattern": "^[a-z0-9_.-]+$"
    },
    "vec2": {
      "type": "array",
      "prefixItems": [
        {
          "type": "number"
        },
        {
          "type": "number"
        }
      ],
      "items": false
    },
    "positive_vec2": {
      "type": "array",
      "prefixItems": [
        {
          "type": "number",
          "exclusiveMinimum": 0
        },
        {
          "type": "number",
          "exclusiveMinimum": 0
        }
      ],
      "items": false
    },
    "pose": {
      "type": "array",
      "prefixItems": [
        {
          "type": "number"
        },
        {
          "type": "number"
        },
        {
          "type": "number"
        }
      ],
      "items": false
    },
    "active": {
      "type": "array",
      "uniqueItems": true,
      "items": {
        "$ref": "#/$defs/id"
      }
    },
    "box": {
      "type": "object",
      "additionalProperties": false,
      "required": [
        "id",
        "type",
        "min",
        "max"
      ],
      "properties": {
        "id": {
          "$ref": "#/$defs/id"
        },
        "type": {
          "const": "box"
        },
        "min": {
          "$ref": "#/$defs/vec2"
        },
        "max": {
          "$ref": "#/$defs/vec2"
        },
        "active_in": {
          "$ref": "#/$defs/active"
        }
      }
    },
    "surface": {
      "type": "object",
      "additionalProperties": false,
      "required": [
        "id",
        "type",
        "min",
        "max",
        "material",
        "label"
      ],
      "properties": {
        "id": {
          "$ref": "#/$defs/id"
        },
        "type": {
          "const": "box"
        },
        "min": {
          "$ref": "#/$defs/vec2"
        },
        "max": {
          "$ref": "#/$defs/vec2"
        },
        "material": {
          "type": "string",
          "minLength": 1
        },
        "active_in": {
          "type": "array",
          "items": {
            "$ref": "#/$defs/id"
          }
        },
        "label": {
          "type": "string",
          "minLength": 1
        }
      }
    },
    "terrain": {
      "type": "object",
      "additionalProperties": false,
      "required": [
        "id",
        "type",
        "min",
        "max",
        "base_height_m",
        "grade_x",
        "grade_y",
        "roughness"
      ],
      "properties": {
        "id": {
          "$ref": "#/$defs/id"
        },
        "type": {
          "const": "height_patch"
        },
        "min": {
          "$ref": "#/$defs/vec2"
        },
        "max": {
          "$ref": "#/$defs/vec2"
        },
        "base_height_m": {
          "type": "number"
        },
        "grade_x": {
          "type": "number",
          "minimum": -2,
          "maximum": 2
        },
        "grade_y": {
          "type": "number",
          "minimum": -2,
          "maximum": 2
        },
        "roughness": {
          "type": "number",
          "description": "Terrain height-disturbance amplitude in meters.",
          "minimum": 0,
          "maximum": 1
        },
        "active_in": {
          "$ref": "#/$defs/active"
        }
      }
    },
    "conflict_zone": {
      "type": "object",
      "additionalProperties": false,
      "required": [
        "id",
        "type",
        "min",
        "max",
        "authority"
      ],
      "properties": {
        "id": {
          "$ref": "#/$defs/id"
        },
        "type": {
          "const": "box"
        },
        "min": {
          "$ref": "#/$defs/vec2"
        },
        "max": {
          "$ref": "#/$defs/vec2"
        },
        "authority": {
          "enum": [
            "shadow",
            "control"
          ]
        },
        "active_in": {
          "$ref": "#/$defs/active"
        }
      }
    },
    "vec3": {
      "type": "array",
      "prefixItems": [
        {
          "type": "number"
        },
        {
          "type": "number"
        },
        {
          "type": "number"
        }
      ],
      "items": false
    },
    "positive_vec3": {
      "type": "array",
      "prefixItems": [
        {
          "type": "number",
          "exclusiveMinimum": 0
        },
        {
          "type": "number",
          "exclusiveMinimum": 0
        },
        {
          "type": "number",
          "exclusiveMinimum": 0
        }
      ],
      "items": false
    },
    "world_collision": {
      "type": "object",
      "additionalProperties": false,
      "required": [
        "type",
        "position_m",
        "size_m",
        "material"
      ],
      "properties": {
        "type": {
          "const": "box"
        },
        "position_m": {
          "$ref": "#/$defs/vec3"
        },
        "size_m": {
          "$ref": "#/$defs/positive_vec3"
        },
        "yaw_degrees": {
          "type": "number"
        },
        "material": {
          "$ref": "#/$defs/id"
        }
      }
    },
    "world_object": {
      "type": "object",
      "additionalProperties": false,
      "required": [
        "id",
        "prefab",
        "position_m",
        "collisions"
      ],
      "properties": {
        "id": {
          "$ref": "#/$defs/id"
        },
        "prefab": {
          "$ref": "#/$defs/id"
        },
        "position_m": {
          "$ref": "#/$defs/vec3"
        },
        "scale": {
          "$ref": "#/$defs/positive_vec3"
        },
        "yaw_degrees": {
          "type": "number"
        },
        "active_in": {
          "$ref": "#/$defs/active"
        },
        "collisions": {
          "type": "array",
          "minItems": 1,
          "items": {
            "$ref": "#/$defs/world_collision"
          }
        }
      }
    },
    "actor": {
      "type": "object",
      "additionalProperties": false,
      "required": [
        "id",
        "type",
        "path",
        "speed_mps",
        "radius_m",
        "active_in",
        "collision",
        "visual"
      ],
      "properties": {
        "id": {
          "$ref": "#/$defs/id"
        },
        "type": {
          "enum": [
            "patrol",
            "wander",
            "dwell",
            "seeded-wander"
          ]
        },
        "path": {
          "type": "array",
          "minItems": 2,
          "items": {
            "$ref": "#/$defs/vec2"
          }
        },
        "speed_mps": {
          "type": "number",
          "exclusiveMinimum": 0
        },
        "radius_m": {
          "type": "number",
          "exclusiveMinimum": 0
        },
        "active_in": {
          "$ref": "#/$defs/active"
        },
        "dormant_until_summoned": {
          "type": "boolean"
        },
        "collision": {
          "enum": [
            "fatal",
            "social"
          ]
        },
        "visual": {
          "type": "object",
          "additionalProperties": false,
          "required": [
            "model",
            "ref_radius_m"
          ],
          "properties": {
            "model": {
              "type": "string",
              "minLength": 1
            },
            "kind": {
              "enum": [
                "vehicle",
                "pedestrian"
              ]
            },
            "ref_radius_m": {
              "type": "number",
              "exclusiveMinimum": 0
            }
          }
        },
        "waits": {
          "type": "array",
          "items": {
            "type": "number",
            "minimum": 0
          }
        }
      }
    }
  }
}
